{
  "$schema": "https://json-schema.org/draft/2020-12/schema",
  "$id": "openmathmodel.contracts.v1.delivery-manifest",
  "title": "DeliveryManifest",
  "description": "最终成果页正文投影：本次运行的成果交付清单。数据源是 artifacts 表（run 产出的产物列表）与各阶段最新成功输出（题目标题、实验关键指标、检验结论、论文引用）。运行尚无任何可交付内容时整体为 null，由 stage-outputs 端点表达。",
  "type": "object",
  "properties": {
    "run_id": { "$ref": "#/$defs/run_id" },
    "problem_title": {
      "type": ["string", "null"],
      "description": "PROBLEM_ANALYSIS 提取的任务标题；模拟链或阶段未完成时为 null。"
    },
    "artifacts": {
      "type": "array",
      "items": { "$ref": "#/$defs/artifact_projection" },
      "description": "本次运行产出的交付物（按创建顺序）；投影形状与 ModelingWorkspaceView.artifacts 一致。"
    },
    "key_metrics": {
      "type": ["object", "null"],
      "description": "EXPERIMENTING 阶段的核心指标（自由载荷：指标名 → 数值）；实验未完成时为 null，脚本未打印指标时为空对象。"
    },
    "validation_verdict": {
      "oneOf": [
        { "type": "null" },
        { "$ref": "#/$defs/verdict" }
      ],
      "description": "VALIDATING 阶段的总体结论；检验未完成时为 null。"
    },
    "paper_citation": {
      "oneOf": [
        { "type": "null" },
        { "$ref": "#/$defs/paper_citation" }
      ],
      "description": "论文引用（标题、摘要、关键词与草稿产物指引）；论文阶段未完成时为 null。"
    },
    "delivery": {
      "oneOf": [
        { "type": "null" },
        { "$ref": "#/$defs/delivery_record" }
      ],
      "description": "交付记录（H5 DeliveryManifest 真实化）：G4 定稿闸门的交付状态 + 终稿审计计数 + 确定性一致性检查（论文产物哈希可读、审计 0 发现、已插入图件有产物、实验指标出现在论文里、检验结论在场）+ 文件计数；只有真实论文草稿在场时才有，否则（模拟链、未到论文阶段）为 null。可选字段：旧消费者可忽略。"
    },
    "updated_at": { "$ref": "#/$defs/timestamp" }
  },
  "required": [
    "run_id",
    "problem_title",
    "artifacts",
    "key_metrics",
    "validation_verdict",
    "paper_citation",
    "updated_at"
  ],
  "additionalProperties": false,
  "$defs": {
    "run_id": { "type": "string", "pattern": "^run_[0-9a-f]{32}$" },
    "timestamp": {
      "type": "string",
      "pattern": "^\\d{4}-\\d{2}-\\d{2}T\\d{2}:\\d{2}:\\d{2}(\\.\\d{1,6})?Z$",
      "description": "UTC ISO-8601，统一以 Z 结尾。"
    },
    "verdict": {
      "type": "string",
      "enum": ["pass", "concerns", "fail"],
      "description": "检验总体结论：pass 可信 / concerns 可用但有保留 / fail 不可信需重做。"
    },
    "artifact_projection": {
      "type": "object",
      "properties": {
        "id": { "type": "string", "pattern": "^art_[0-9a-f]{32}$" },
        "kind": {
          "type": "string",
          "enum": ["dataset", "code", "figure", "table", "log", "report", "paper", "model", "other"]
        },
        "name": { "type": "string", "minLength": 1, "maxLength": 300 },
        "media_type": { "type": "string", "minLength": 1, "maxLength": 255 },
        "size_bytes": { "type": ["integer", "null"], "minimum": 0 },
        "status": { "type": "string", "enum": ["PENDING", "READY", "STALE", "DELETED"] },
        "producer_node": { "type": ["string", "null"], "maxLength": 100 },
        "download_url": {
          "oneOf": [
            { "type": "null" },
            { "type": "string", "pattern": "^/api/v1/artifacts/art_[0-9a-f]{32}/download$" }
          ]
        },
        "sha256": {
          "oneOf": [
            { "type": "null" },
            { "type": "string", "pattern": "^[0-9a-f]{64}$" }
          ],
          "description": "产物登记时的内容摘要（下载端点按它核验）；交付清单据此做「文件 + 哈希」。可选字段（形状与 ModelingWorkspaceView.artifacts 一致、另带哈希）：旧消费者可忽略；登记缺失时为 null。"
        }
      },
      "required": ["id", "kind", "name", "media_type", "size_bytes", "status", "producer_node", "download_url"],
      "additionalProperties": false
    },
    "delivery_record": {
      "type": "object",
      "properties": {
        "status": {
          "type": "string",
          "enum": ["not_ready", "pending_confirmation", "confirmed", "returned_for_revision", "unattended"],
          "description": "交付状态（按产出当前论文那一趟的 G4 审批回放）：pending_confirmation = G4 挂起待人确认；confirmed = 用户「确认交付」；returned_for_revision = 用户「退回修改」（新一版论文到来前保持）；unattended = 论文已发布但该运行没有挂 G4（无人值守 / 评测）；not_ready = 审批过期 / 取消等未成交付的状态。"
        },
        "paper_version": { "type": ["integer", "null"], "minimum": 1, "description": "对应的 DocumentDraft.version。" },
        "approval_id": { "type": ["string", "null"], "description": "G4 审批 id；没挂过 G4 时为 null。" },
        "confirmed_at": {
          "oneOf": [{ "type": "null" }, { "$ref": "#/$defs/timestamp" }],
          "description": "用户确认交付的时间；未确认为 null。"
        },
        "comment": { "type": ["string", "null"], "description": "用户在 G4 拍板时留下的备注（确认或退回）；没有为 null。" },
        "audit": {
          "oneOf": [{ "type": "null" }, { "$ref": "#/$defs/delivery_audit" }],
          "description": "终稿审计与图件 / 文献计数（来自 DocumentDraft 的确定性字段）；论文未审计（旧运行）为 null。"
        },
        "checks": {
          "type": "array",
          "items": { "$ref": "#/$defs/delivery_check" },
          "description": "一致性检查，固定顺序：paper_artifact_ready → audit_clean → figures_delivered → metrics_in_paper → validation_reported。全是代码判定，不经模型。"
        },
        "files_total": { "type": "integer", "minimum": 0, "description": "交付清单里的产物数（与 artifacts 同口径）。" },
        "files_ready": { "type": "integer", "minimum": 0, "description": "其中可下载（READY 且内容对象可读、哈希对得上）的产物数。" },
        "files_hashed": { "type": "integer", "minimum": 0, "description": "其中带登记哈希的产物数。" }
      },
      "required": ["status", "paper_version", "approval_id", "confirmed_at", "comment", "audit", "checks", "files_total", "files_ready", "files_hashed"],
      "additionalProperties": false
    },
    "delivery_audit": {
      "type": "object",
      "properties": {
        "findings_total": { "type": "integer", "minimum": 0 },
        "findings_by_kind": {
          "type": "object",
          "additionalProperties": { "type": "integer", "minimum": 0 },
          "description": "发现类型 → 条数（键取 audit_finding.kind；消费者须容忍未知取值）。"
        },
        "frozen_numbers_total": { "type": "integer", "minimum": 0 },
        "figures_total": { "type": "integer", "minimum": 0 },
        "figures_inserted": { "type": "integer", "minimum": 0 },
        "references_total": { "type": "integer", "minimum": 0 },
        "references_cited": { "type": "integer", "minimum": 0 }
      },
      "required": ["findings_total", "findings_by_kind", "frozen_numbers_total", "figures_total", "figures_inserted", "references_total", "references_cited"],
      "additionalProperties": false
    },
    "delivery_check": {
      "type": "object",
      "properties": {
        "id": {
          "type": "string",
          "enum": ["paper_artifact_ready", "audit_clean", "figures_delivered", "metrics_in_paper", "validation_reported"],
          "description": "检查项：论文草稿产物可读且哈希对得上 / 终稿审计 0 发现 / 已插入图件都有可下载产物 / 实验指标（冻结清单 EXPERIMENTING 项）逐个出现在论文里 / 检验结论在场。消费者须容忍未知取值。"
        },
        "label": { "type": "string", "description": "人可读的检查名。" },
        "passed": { "type": "boolean" },
        "detail": { "type": "string", "description": "判定依据（计数、缺失项点名）。" }
      },
      "required": ["id", "label", "passed", "detail"],
      "additionalProperties": false
    },
    "paper_citation": {
      "type": "object",
      "properties": {
        "title": { "type": "string", "description": "论文标题。" },
        "abstract": { "type": ["string", "null"], "description": "论文摘要。" },
        "keywords": {
          "type": "array",
          "items": { "type": "string" },
          "description": "关键词；未给出时为空列表。"
        },
        "artifact_id": {
          "oneOf": [
            { "type": "null" },
            { "type": "string", "pattern": "^art_[0-9a-f]{32}$" }
          ],
          "description": "论文草稿产物（kind=paper）；沿 /v1/artifacts/{id}/download 获取本体。"
        }
      },
      "required": ["title", "abstract", "keywords", "artifact_id"],
      "additionalProperties": false
    }
  }
}
